type,title,image,description,ExampleTxt,ExampleLink,ExampleImag
ttl,Refers to data,tit1_data,"Data type,changes in data, refer to the data directly","Daily Covid cases surge 60% in a week to 61,900 in biggest rise since Freedom Day as admissions climb by a quarter and deaths creep up 9%",https://www.dailymail.co.uk/news/article-10591029/Daily-Covid-cases-surge-60-week-61-900-biggest-rise-Freedom-Day.html,
ttl,States an issue,tit2_name,States an issue (fact or study) but not the data directly,"Elections 2022: live council results for England, Scotland and Wales",https://www.theguardian.com/politics/ng-interactive/2022/may/05/elections-2022-results-live-local-council-england-scotland-wales,
ttl,Makes a judgment,tit3_judg,Makes a judgment on the data or the issue at hand,"Digital banks beat the high street on customer service",https://www.thetimes.co.uk/article/online-banks-outrank-high-street-rivals-for-customer-service-x6jwsxt5r,
ttl,Ask a question,tit4_q, Use the question as the title directly,"Does Gen Z spend too much time on social media?",https://www.economist.com/graphic-detail/2022/08/10/does-gen-z-spend-too-much-time-on-social-media,
ttl,Include emotional appeal,tit5_emo,Use emotional adjectives(on the data or the fact) to arouse users' feelings,"Boris Johnson’s tumultuous three years as prime minister – in charts",https://www.theguardian.com/politics/2022/jul/07/boris-johnsons-tumultuous-three-years-as-prime-minister-in-charts,
dataSource,Give the link,ds1_link,"Give the relevant database link directly then people can click to enter","Data from <b>Effis</b> shows that as of 23 July, just over 515,000 hectares (1.27m acres) of land had been burned across EU countries...",https://www.theguardian.com/environment/ng-interactive/2022/jul/26/how-europe-has-been-hit-by-record-fire-damage-and-temperatures,
dataSource,Mention the data source name only,ds2_name,Cite the name of the institute/data report/website without giving a link,"The NHS has succeeded in eliminating two-year waits, but in future the length of delays in treatment looks set to creep up again.",https://www.thetimes.co.uk/article/hospital-treatment-is-still-a-waiting-game-pk5d85bfz,
narrativeDevice,News about the inverted pyramid,na1_pyr,"In journalism, the inverted pyramid refers to a story structure where the most important information (or what might even be considered the conclusion) is presented first.The who, what, when, where and why appear at the start of a story, followed by supporting details and background information.","Boris Johnson has resigned as Conservative leader after nearly three years in Downing Street. After taking the helm in July 2019 following Theresa May’s resignation, Johnson secured a large Conservative majority in parliament after calling a snap general election in December that year...",https://www.theguardian.com/politics/2022/jul/07/boris-johnsons-tumultuous-three-years-as-prime-minister-in-charts,
narrativeDevice,Basic description,na2_bac,"Only a rough summary of the content， describing the real news event","As the final votes are counted, heavy Conservative losses are tempered by a mixed picture for Labour while Lib Dems and the Greens perform well. The SNP continues to dominate in Scotland and Plaid Cymru gain seats in their heartlands and beyond.",https://www.theguardian.com/politics/ng-interactive/2022/may/05/elections-2022-results-live-local-council-england-scotland-wales,
narrativeDevice,Dill down,na3_drill,"Guide the reader to focus on a specific area from a large overall image, and highlight local problems through a holistic local approach.","When Covid-19 hit Georgia in March 2020, the Atlanta Breakfast Club closed its doors to in-person dining for weeks on end...general managers and other staff at a time of fierce competition for workers in one of the tightest labour markets in the US.",https://www.ft.com/content/5a13b24b-a16c-429c-9128-d48dd183be5c,
narrativeDevice,Compare difference/proportion,na4_com,Show the influence of a factor by comparing different data,"This is lowest among the over-70s: only 6% of those aged 70-79 in England have not had both doses. However, for 50- to 54-year-olds, who have been eligible for vaccines since mid-March, the number not fully vaccinated stands at 19%.",https://www.theguardian.com/world/2021/jul/19/are-enough-people-vaccinated-in-time-for-englands-freedom-day,
narrativeDevice,Emphasize value/extreme/outlier,na5_time," Highlight an abnormal value to highlight problems or contrast， and attempts to explain why this is happening or resulting in consequences.","In 2016, global temperatures were 1.05C higher than this average – a record in the data that runs to 1850. The 13 hottest global temperatures in the data have all occurred since 2000.",https://www.theguardian.com/environment/ng-interactive/2022/jul/26/how-europe-has-been-hit-by-record-fire-damage-and-temperatures,
narrativeDevice,Emotional appeal,na6_emo,"Empathy engages us with the story content: we pay attention, and we perceive and reflect on the message.","He died the following month, aged 89. 'My nan was too afraid to go to the hospital, as he was put in a Covid ward. His death certificate stated Covid on it as well as heart failure and the UTI. He was a very poorly man. He didn’t need any extra oxygen while he had Covid, but it may not have helped his heart, which eventually gave out.'",https://www.thetimes.co.uk/article/what-is-the-uks-true-covid-death-toll-lzpb0xnqs,
narrativeDevice,Changing over time,na7_out,"Compare the changes of some data under the effect of time, and summarize the trend of things.","Initially, reinfections with coronavirus were rare. But as the Omicron variant arrived at the end of 2021, and immunity from previous infections waned, reinfections increased to take up a greater proportion of overall infections.",https://www.theguardian.com/world/2022/jun/01/covid-19-uk-cases-deaths-vaccinations-latest-numbers-coronavirus-national-data,
narrativeDevice,Co-relation,na8_cor,"Describe the correlation/causality between different data.","Most classical measures of social capital, such as civic engagement and intra-class bonding, were not correlated with improved life outcomes, the researchers found. However, one measure looked especially important. “Economic connectedness”—the extent of friendships across social classes—was strongly associated with increased rates of high-school completion, reduced rates of teenage pregnancy and increased income for those born poorer.",https://www.economist.com/graphic-detail/2022/08/11/friendship-across-class-lines-may-boost-social-mobility-and-decrease-poverty,
narrativeDevice,Dissect the fact,na9_facts,"Journalists investigate the relationship between different factors of a story.","Higher interest rates have also raised the chances of a recession in some countries, with economists fearing a return to the stagflation of the 1970s — a situation characterised by persistent price pressures and weak growth…Another point of concern is asset prices, especially for houses.",https://www.ft.com/content/088d3368-bb8b-4ff3-9df7-a7680d4d81b2,
narrativeDevice,Cite the authority,na10_cite,"Quote authoritative people's words/government and other authoritative reports to assist in data explanation.","Authorities should wait until more people are vaccinated before lifting public health restrictions, says Christina Pagel, director of UCL’s Clinical Operational Research Unit, said There is no disadvantage to more people being vaccinated..",https://www.theguardian.com/world/2021/jul/19/are-enough-people-vaccinated-in-time-for-englands-freedom-day,
narrativeDevice,Opposite point of view,na11_opp,"On the basis of quoting a point of view, add the opposite point of view to illustrate the event from different perspectives.","Others, however, back the government’s decision to unlock now. “This virus is not going away,” says Paul Hunter, professor in medicine at the University of East Anglia.",https://www.theguardian.com/world/2021/jul/19/are-enough-people-vaccinated-in-time-for-englands-freedom-day,
narrativeDevice,Predict,na12_pri,"Based on the existing data, predict the future development direction of the event","This includes economists’ expectations for the future, which show inflation projections being steadily revised up for 2023, according to leading forecasters polled by Consensus Economics.",https://www.ft.com/content/088d3368-bb8b-4ff3-9df7-a7680d4d81b2,
narrativeDevice,Method,na13_method,"Provide methods for data calculation/collection.","To fill in these voids in our understanding of the pandemic, The Economist has built a machine-learning model, which estimates excess deaths for every country on every day since the pandemic began.",https://www.economist.com/graphic-detail/coronavirus-excess-deaths-estimates,
visTitle,Refers to data,vistit1_data,"Data type,changes in data, refer to the data directly","While three in four people in rich countries are vaccinated against Covid, just over one in seven is in poor countries",https://www.theguardian.com/global-development/2022/jul/21/covid-vaccine-figures-lay-bare-global-inequality-as-global-target-missed,
visTitle,States an issue,vistit2_fact,States an issue (fact or study) but not the data directly,"UK: people in the hospital with coronavirus each day",https://www.theguardian.com/world/2022/jun/01/covid-19-uk-cases-deaths-vaccinations-latest-numbers-coronavirus-national-data,
visTitle,Makes a judgment,vistit3_judge,Makes a judgment on the data or the issue at hand,The big wait,https://www.thetimes.co.uk/article/hospital-treatment-is-still-a-waiting-game-pk5d85bfz,
visTitle,Ask a question,vistit4_q,Use the question as the title directly,Who-is and isn’t vaccinated?,https://www.theguardian.com/world/2022/jun/01/covid-19-uk-cases-deaths-vaccinations-latest-numbers-coronavirus-national-data,
visCaption,Data sources,cap1_ds,"Specify the data source or give a link to the data source.",Data：data.gov.uk,https://www.theguardian.com/world/2022/jun/01/covid-19-uk-cases-deaths-vaccinations-latest-numbers-coronavirus-national-data,
visCaption,Visualization source/ producer,cap2_mak,"Describe source of visualization.",Guardian Graphic,https://www.theguardian.com/global-development/2022/jul/21/covid-vaccine-figures-lay-bare-global-inequality-as-global-target-missed,
visCaption,Description visualization,cap3_tre,"Describe the specific trend of visualization and summarize data events.","NHS England waiting list for treatment. The NHS is prioritizing very long waits, yet the overall list continues to grow",https://www.thetimes.co.uk/article/hospital-treatment-is-still-a-waiting-game-pk5d85bfz,
visCaption,Supplement additional information/details,cap4_add,"Add other information, such as information not clearly shown in the chart, or add details for a certain data, to further supplement the chart","Note: Time periods of BA.4 and BA.5 becoming dominant are estimates.",https://www.nytimes.com/interactive/2022/07/07/us/ba5-covid-omicron-subvariant.html,
visCaption,Explain visual encoding,cap5_code,"Visual coding method, such as specific sampling method, data selection event segment, etc.","Note: Charts show 14-day case averages, and the frequency of variants among cases is an estimate. Sequencing rates can reflect localized trends based on testing from a particular region or hospital. Charts show the latest available data, which may be lagged and may change as additional sequences are completed. Recent data is based on the smallest samples and is especially likely to change.",https://www.nytimes.com/interactive/2022/07/07/us/ba5-covid-omicron-subvariant.html,
visAnnotation,,,,,,
visTech,,,,,,
interaction,,,,,,
